"01101","札幌市中央区","サッポロシチュウオウク","SAPPORO SHI CHUO KU","01","北海道","ホッカイドウ","HOKKAIDO","false"
"01102","札幌市北区","サッポロシキタク","SAPPORO SHI KITA KU","01","北海道","ホッカイドウ","HOKKAIDO","false"
"01103","札幌市東区","サッポロシヒガシク","SAPPORO SHI HIGASHI KU","01","北海道","ホッカイドウ","HOKKAIDO","false"
"01104","札幌市白石区","サッポロシシロイシク","SAPPORO SHI SHIROISHI KU","01","北海道","ホッカイドウ","HOKKAIDO","false"
"01105","札幌市豊平区","サッポロシトヨヒラク","SAPPORO SHI TOYOHIRA KU","01","北海道","ホッカイドウ","HOKKAIDO","false"
"01106","札幌市南区","サッポロシミナミク","SAPPORO SHI MINAMI KU","01","北海道","ホッカイドウ","HOKKAIDO","false"
"01107","札幌市西区","サッポロシニシク","SAPPORO SHI NISHI KU","01","北海道","ホッカイドウ","HOKKAIDO","false"
"01108","札幌市厚別区","サッポロシアツベツク","SAPPORO SHI ATSUBETSU KU","01","北海道","ホッカイドウ","HOKKAIDO","false"
"01109","札幌市手稲区","サッポロシテイネク","SAPPORO SHI TEINE KU","01","北海道","ホッカイドウ","HOKKAIDO","false"
"01110","札幌市清田区","サッポロシキヨタク","SAPPORO SHI KIYOTA KU","01","北海道","ホッカイドウ","HOKKAIDO","false"
"01202","函館市","ハコダテシ","HAKODATE SHI","01","北海道","ホッカイドウ","HOKKAIDO","false"
"01203","小樽市","オタルシ","OTARU SHI","01","北海道","ホッカイドウ","HOKKAIDO","false"
"01204","旭川市","アサヒカワシ","ASAHIKAWA SHI","01","北海道","ホッカイドウ","HOKKAIDO","false"
"01205","室蘭市","ムロランシ","MURORAN SHI","01","北海道","ホッカイドウ","HOKKAIDO","false"
"01206","釧路市","クシロシ","KUSHIRO SHI","01","北海道","ホッカイドウ","HOKKAIDO","false"
"01207","帯広市","オビヒロシ","OBIHIRO SHI","01","北海道","ホッカイドウ","HOKKAIDO","false"
"01208","北見市","キタミシ","KITAMI SHI","01","北海道","ホッカイドウ","HOKKAIDO","false"
"01209","夕張市","ユウバリシ","YUBARI SHI","01","北海道","ホッカイドウ","HOKKAIDO","false"
"01210","岩見沢市","イワミザワシ","IWAMIZAWA SHI","01","北海道","ホッカイドウ","HOKKAIDO","false"
"01211","網走市","アバシリシ","ABASHIRI SHI","01","北海道","ホッカイドウ","HOKKAIDO","false"
"01212","留萌市","ルモイシ","RUMOI SHI","01","北海道","ホッカイドウ","HOKKAIDO","false"
"01213","苫小牧市","トマコマイシ","TOMAKOMAI SHI","01","北海道","ホッカイドウ","HOKKAIDO","false"
"01214","稚内市","ワッカナイシ","WAKKANAI SHI","01","北海道","ホッカイドウ","HOKKAIDO","false"
"01215","美唄市","ビバイシ","BIBAI SHI","01","北海道","ホッカイドウ","HOKKAIDO","false"
"01216","芦別市","アシベツシ","ASHIBETSU SHI","01","北海道","ホッカイドウ","HOKKAIDO","false"
"01217","江別市","エベツシ","EBETSU SHI","01","北海道","ホッカイドウ","HOKKAIDO","false"
"01218","赤平市","アカビラシ","AKABIRA SHI","01","北海道","ホッカイドウ","HOKKAIDO","false"
"01219","紋別市","モンベツシ","MOMBETSU SHI","01","北海道","ホッカイドウ","HOKKAIDO","false"
"01220","士別市","シベツシ","SHIBETSU SHI","01","北海道","ホッカイドウ","HOKKAIDO","false"
"01221","名寄市","ナヨロシ","NAYORO SHI","01","北海道","ホッカイドウ","HOKKAIDO","false"
"01222","三笠市","ミカサシ","MIKASA SHI","01","北海道","ホッカイドウ","HOKKAIDO","false"
"01223","根室市","ネムロシ","NEMURO SHI","01","北海道","ホッカイドウ","HOKKAIDO","false"
"01224","千歳市","チトセシ","CHITOSE SHI","01","北海道","ホッカイドウ","HOKKAIDO","false"
"01225","滝川市","タキカワシ","TAKIKAWA SHI","01","北海道","ホッカイドウ","HOKKAIDO","false"
"01226","砂川市","スナガワシ","SUNAGAWA SHI","01","北海道","ホッカイドウ","HOKKAIDO","false"
"01227","歌志内市","ウタシナイシ","UTASHINAI SHI","01","北海道","ホッカイドウ","HOKKAIDO","false"
"01228","深川市","フカガワシ","FUKAGAWA SHI","01","北海道","ホッカイドウ","HOKKAIDO","false"
"01229","富良野市","フラノシ","FURANO SHI","01","北海道","ホッカイドウ","HOKKAIDO","false"
"01230","登別市","ノボリベツシ","NOBORIBETSU SHI","01","北海道","ホッカイドウ","HOKKAIDO","false"
"01231","恵庭市","エニワシ","ENIWA SHI","01","北海道","ホッカイドウ","HOKKAIDO","false"
"01233","伊達市","ダテシ","DATE SHI","01","北海道","ホッカイドウ","HOKKAIDO","false"
"01234","北広島市","キタヒロシマシ","KITAHIROSHIMA SHI","01","北海道","ホッカイドウ","HOKKAIDO","false"
"01235","石狩市","イシカリシ","ISHIKARI SHI","01","北海道","ホッカイドウ","HOKKAIDO","false"
"01236","北斗市","ホクトシ","HOKUTO SHI","01","北海道","ホッカイドウ","HOKKAIDO","false"
"01303","石狩郡当別町","イシカリグントウベツチョウ","ISHIKARI GUN TOBETSU CHO","01","北海道","ホッカイドウ","HOKKAIDO","false"
"01304","石狩郡新篠津村","イシカリグンシンシノツムラ","ISHIKARI GUN SHINSHINOTSU MURA","01","北海道","ホッカイドウ","HOKKAIDO","false"
"01331","松前郡松前町","マツマエグンマツマエチョウ","MATSUMAE GUN MATSUMAE CHO","01","北海道","ホッカイドウ","HOKKAIDO","false"
"01332","松前郡福島町","マツマエグンフクシマチョウ","MATSUMAE GUN FUKUSHIMA CHO","01","北海道","ホッカイドウ","HOKKAIDO","false"
"01333","上磯郡知内町","カミイソグンシリウチチョウ","KAMIISO GUN SHIRIUCHI CHO","01","北海道","ホッカイドウ","HOKKAIDO","false"
"01334","上磯郡木古内町","カミイソグンキコナイチョウ","KAMIISO GUN KIKONAI CHO","01","北海道","ホッカイドウ","HOKKAIDO","false"
"01337","亀田郡七飯町","カメダグンナナエチョウ","KAMEDA GUN NANAE CHO","01","北海道","ホッカイドウ","HOKKAIDO","false"
"01343","茅部郡鹿部町","カヤベグンシカベチョウ","KAYABE GUN SHIKABE CHO","01","北海道","ホッカイドウ","HOKKAIDO","false"
"01345","茅部郡森町","カヤベグンモリマチ","KAYABE GUN MORI MACHI","01","北海道","ホッカイドウ","HOKKAIDO","false"
"01346","二海郡八雲町","フタミグンヤクモチョウ","FUTAMI GUN YAKUMO CHO","01","北海道","ホッカイドウ","HOKKAIDO","false"
"01347","山越郡長万部町","ヤマコシグンオシャマンベチョウ","YAMAKOSHI GUN OSHAMAMBE CHO","01","北海道","ホッカイドウ","HOKKAIDO","false"
"01361","檜山郡江差町","ヒヤマグンエサシチョウ","HIYAMA GUN ESASHI CHO","01","北海道","ホッカイドウ","HOKKAIDO","false"
"01362","檜山郡上ノ国町","ヒヤマグンカミノクニチョウ","HIYAMA GUN KAMINOKUNI CHO","01","北海道","ホッカイドウ","HOKKAIDO","false"
"01363","檜山郡厚沢部町","ヒヤマグンアッサブチョウ","HIYAMA GUN ASSABU CHO","01","北海道","ホッカイドウ","HOKKAIDO","false"
"01364","爾志郡乙部町","ニシグンオトベチョウ","NISHI GUN OTOBE CHO","01","北海道","ホッカイドウ","HOKKAIDO","false"
"01367","奥尻郡奥尻町","オクシリグンオクシリチョウ","OKUSHIRI GUN OKUSHIRI CHO","01","北海道","ホッカイドウ","HOKKAIDO","false"
"01370","瀬棚郡今金町","セタナグンイマカネチョウ","SETANA GUN IMAKANE CHO","01","北海道","ホッカイドウ","HOKKAIDO","false"
"01371","久遠郡せたな町","クドウグンセタナチョウ","KUDO GUN SETANA CHO","01","北海道","ホッカイドウ","HOKKAIDO","false"
"01391","島牧郡島牧村","シママキグンシママキムラ","SHIMAMAKI GUN SHIMAMAKI MURA","01","北海道","ホッカイドウ","HOKKAIDO","false"
"01392","寿都郡寿都町","スッツグンスッツチョウ","SUTTSU GUN SUTTSU CHO","01","北海道","ホッカイドウ","HOKKAIDO","false"
"01393","寿都郡黒松内町","スッツグンクロマツナイチョウ","SUTTSU GUN KUROMATSUNAI CHO","01","北海道","ホッカイドウ","HOKKAIDO","false"
"01394","磯谷郡蘭越町","イソヤグンランコシチョウ","ISOYA GUN RANKOSHI CHO","01","北海道","ホッカイドウ","HOKKAIDO","false"
"01395","虻田郡ニセコ町","アブタグンニセコチョウ","ABUTA GUN NISEKO CHO","01","北海道","ホッカイドウ","HOKKAIDO","false"
"01396","虻田郡真狩村","アブタグンマッカリムラ","ABUTA GUN MAKKARI MURA","01","北海道","ホッカイドウ","HOKKAIDO","false"
"01397","虻田郡留寿都村","アブタグンルスツムラ","ABUTA GUN RUSUTSU MURA","01","北海道","ホッカイドウ","HOKKAIDO","false"
"01398","虻田郡喜茂別町","アブタグンキモベツチョウ","ABUTA GUN KIMOBETSU CHO","01","北海道","ホッカイドウ","HOKKAIDO","false"
"01399","虻田郡京極町","アブタグンキョウゴクチョウ","ABUTA GUN KYOGOKU CHO","01","北海道","ホッカイドウ","HOKKAIDO","false"
"01400","虻田郡倶知安町","アブタグンクッチャンチョウ","ABUTA GUN KUTCHAN CHO","01","北海道","ホッカイドウ","HOKKAIDO","false"
"01401","岩内郡共和町","イワナイグンキョウワチョウ","IWANAI GUN KYOWA CHO","01","北海道","ホッカイドウ","HOKKAIDO","false"
"01402","岩内郡岩内町","イワナイグンイワナイチョウ","IWANAI GUN IWANAI CHO","01","北海道","ホッカイドウ","HOKKAIDO","false"
"01403","古宇郡泊村","フルウグントマリムラ","FURU GUN TOMARI MURA","01","北海道","ホッカイドウ","HOKKAIDO","false"
"01404","古宇郡神恵内村","フルウグンカモエナイムラ","FURU GUN KAMOENAI MURA","01","北海道","ホッカイドウ","HOKKAIDO","false"
"01405","積丹郡積丹町","シャコタングンシャコタンチョウ","SHAKOTAN GUN SHAKOTAN CHO","01","北海道","ホッカイドウ","HOKKAIDO","false"
"01406","古平郡古平町","フルビラグンフルビラチョウ","FURUBIRA GUN FURUBIRA CHO","01","北海道","ホッカイドウ","HOKKAIDO","false"
"01407","余市郡仁木町","ヨイチグンニキチョウ","YOICHI GUN NIKI CHO","01","北海道","ホッカイドウ","HOKKAIDO","false"
"01408","余市郡余市町","ヨイチグンヨイチチョウ","YOICHI GUN YOICHI CHO","01","北海道","ホッカイドウ","HOKKAIDO","false"
"01409","余市郡赤井川村","ヨイチグンアカイガワムラ","YOICHI GUN AKAIGAWA MURA","01","北海道","ホッカイドウ","HOKKAIDO","false"
"01423","空知郡南幌町","ソラチグンナンポロチョウ","SORACHI GUN NAMPORO CHO","01","北海道","ホッカイドウ","HOKKAIDO","false"
"01424","空知郡奈井江町","ソラチグンナイエチョウ","SORACHI GUN NAIE CHO","01","北海道","ホッカイドウ","HOKKAIDO","false"
"01425","空知郡上砂川町","ソラチグンカミスナガワチョウ","SORACHI GUN KAMISUNAGAWA CHO","01","北海道","ホッカイドウ","HOKKAIDO","false"
"01427","夕張郡由仁町","ユウバリグンユニチョウ","YUBARI GUN YUNI CHO","01","北海道","ホッカイドウ","HOKKAIDO","false"
"01428","夕張郡長沼町","ユウバリグンナガヌマチョウ","YUBARI GUN NAGANUMA CHO","01","北海道","ホッカイドウ","HOKKAIDO","false"
"01429","夕張郡栗山町","ユウバリグンクリヤマチョウ","YUBARI GUN KURIYAMA CHO","01","北海道","ホッカイドウ","HOKKAIDO","false"
"01430","樺戸郡月形町","カバトグンツキガタチョウ","KABATO GUN TSUKIGATA CHO","01","北海道","ホッカイドウ","HOKKAIDO","false"
"01431","樺戸郡浦臼町","カバトグンウラウスチョウ","KABATO GUN URAUSU CHO","01","北海道","ホッカイドウ","HOKKAIDO","false"
"01432","樺戸郡新十津川町","カバトグンシントツカワチョウ","KABATO GUN SHINTOTSUKAWA CHO","01","北海道","ホッカイドウ","HOKKAIDO","false"
"01433","雨竜郡妹背牛町","ウリュウグンモセウシチョウ","URYU GUN MOSEUSHI CHO","01","北海道","ホッカイドウ","HOKKAIDO","false"
"01434","雨竜郡秩父別町","ウリュウグンチップベツチョウ","URYU GUN CHIPPUBETSU CHO","01","北海道","ホッカイドウ","HOKKAIDO","false"
"01436","雨竜郡雨竜町","ウリュウグンウリュウチョウ","URYU GUN URYU CHO","01","北海道","ホッカイドウ","HOKKAIDO","false"
"01437","雨竜郡北竜町","ウリュウグンホクリュウチョウ","URYU GUN HOKURYU CHO","01","北海道","ホッカイドウ","HOKKAIDO","false"
"01438","雨竜郡沼田町","ウリュウグンヌマタチョウ","URYU GUN NUMATA CHO","01","北海道","ホッカイドウ","HOKKAIDO","false"
"01452","上川郡鷹栖町","カミカワグンタカスチョウ","KAMIKAWA GUN TAKASU CHO","01","北海道","ホッカイドウ","HOKKAIDO","false"
"01453","上川郡東神楽町","カミカワグンヒガシカグラチョウ","KAMIKAWA GUN HIGASHIKAGURA CHO","01","北海道","ホッカイドウ","HOKKAIDO","false"
"01454","上川郡当麻町","カミカワグントウマチョウ","KAMIKAWA GUN TOMA CHO","01","北海道","ホッカイドウ","HOKKAIDO","false"
"01455","上川郡比布町","カミカワグンピップチョウ","KAMIKAWA GUN PIPPU CHO","01","北海道","ホッカイドウ","HOKKAIDO","false"
"01456","上川郡愛別町","カミカワグンアイベツチョウ","KAMIKAWA GUN AIBETSU CHO","01","北海道","ホッカイドウ","HOKKAIDO","false"
"01457","上川郡上川町","カミカワグンカミカワチョウ","KAMIKAWA GUN KAMIKAWA CHO","01","北海道","ホッカイドウ","HOKKAIDO","false"
"01458","上川郡東川町","カミカワグンヒガシカワチョウ","KAMIKAWA GUN HIGASHIKAWA CHO","01","北海道","ホッカイドウ","HOKKAIDO","false"
"01459","上川郡美瑛町","カミカワグンビエイチョウ","KAMIKAWA GUN BIEI CHO","01","北海道","ホッカイドウ","HOKKAIDO","false"
"01460","空知郡上富良野町","ソラチグンカミフラノチョウ","SORACHI GUN KAMIFURANO CHO","01","北海道","ホッカイドウ","HOKKAIDO","false"
"01461","空知郡中富良野町","ソラチグンナカフラノチョウ","SORACHI GUN NAKAFURANO CHO","01","北海道","ホッカイドウ","HOKKAIDO","false"
"01462","空知郡南富良野町","ソラチグンミナミフラノチョウ","SORACHI GUN MINAMIFURANO CHO","01","北海道","ホッカイドウ","HOKKAIDO","false"
"01463","勇払郡占冠村","ユウフツグンシムカップムラ","YUFUTSU GUN SHIMUKAPPU MURA","01","北海道","ホッカイドウ","HOKKAIDO","false"
"01464","上川郡和寒町","カミカワグンワッサムチョウ","KAMIKAWA GUN WASSAMU CHO","01","北海道","ホッカイドウ","HOKKAIDO","false"
"01465","上川郡剣淵町","カミカワグンケンブチチョウ","KAMIKAWA GUN KEMBUCHI CHO","01","北海道","ホッカイドウ","HOKKAIDO","false"
"01468","上川郡下川町","カミカワグンシモカワチョウ","KAMIKAWA GUN SHIMOKAWA CHO","01","北海道","ホッカイドウ","HOKKAIDO","false"
"01469","中川郡美深町","ナカガワグンビフカチョウ","NAKAGAWA GUN BIFUKA CHO","01","北海道","ホッカイドウ","HOKKAIDO","false"
"01470","中川郡音威子府村","ナカガワグンオトイネップムラ","NAKAGAWA GUN OTOINEPPU MURA","01","北海道","ホッカイドウ","HOKKAIDO","false"
"01471","中川郡中川町","ナカガワグンナカガワチョウ","NAKAGAWA GUN NAKAGAWA CHO","01","北海道","ホッカイドウ","HOKKAIDO","false"
"01472","雨竜郡幌加内町","ウリュウグンホロカナイチョウ","URYU GUN HOROKANAI CHO","01","北海道","ホッカイドウ","HOKKAIDO","false"
"01481","増毛郡増毛町","マシケグンマシケチョウ","MASHIKE GUN MASHIKE CHO","01","北海道","ホッカイドウ","HOKKAIDO","false"
"01482","留萌郡小平町","ルモイグンオビラチョウ","RUMOI GUN OBIRA CHO","01","北海道","ホッカイドウ","HOKKAIDO","false"
"01483","苫前郡苫前町","トママエグントママエチョウ","TOMAMAE GUN TOMAMAE CHO","01","北海道","ホッカイドウ","HOKKAIDO","false"
"01484","苫前郡羽幌町","トママエグンハボロチョウ","TOMAMAE GUN HABORO CHO","01","北海道","ホッカイドウ","HOKKAIDO","false"
"01485","苫前郡初山別村","トママエグンショサンベツムラ","TOMAMAE GUN SHOSAMBETSU MURA","01","北海道","ホッカイドウ","HOKKAIDO","false"
"01486","天塩郡遠別町","テシオグンエンベツチョウ","TESHIO GUN EMBETSU CHO","01","北海道","ホッカイドウ","HOKKAIDO","false"
"01487","天塩郡天塩町","テシオグンテシオチョウ","TESHIO GUN TESHIO CHO","01","北海道","ホッカイドウ","HOKKAIDO","false"
"01511","宗谷郡猿払村","ソウヤグンサルフツムラ","SOYA GUN SARUFUTSU MURA","01","北海道","ホッカイドウ","HOKKAIDO","false"
"01512","枝幸郡浜頓別町","エサシグンハマトンベツチョウ","ESASHI GUN HAMATOMBETSU CHO","01","北海道","ホッカイドウ","HOKKAIDO","false"
"01513","枝幸郡中頓別町","エサシグンナカトンベツチョウ","ESASHI GUN NAKATOMBETSU CHO","01","北海道","ホッカイドウ","HOKKAIDO","false"
"01514","枝幸郡枝幸町","エサシグンエサシチョウ","ESASHI GUN ESASHI CHO","01","北海道","ホッカイドウ","HOKKAIDO","false"
"01516","天塩郡豊富町","テシオグントヨトミチョウ","TESHIO GUN TOYOTOMI CHO","01","北海道","ホッカイドウ","HOKKAIDO","false"
"01517","礼文郡礼文町","レブングンレブンチョウ","REBUN GUN REBUN CHO","01","北海道","ホッカイドウ","HOKKAIDO","false"
"01518","利尻郡利尻町","リシリグンリシリチョウ","RISHIRI GUN RISHIRI CHO","01","北海道","ホッカイドウ","HOKKAIDO","false"
"01519","利尻郡利尻富士町","リシリグンリシリフジチョウ","RISHIRI GUN RISHIRIFUJI CHO","01","北海道","ホッカイドウ","HOKKAIDO","false"
"01520","天塩郡幌延町","テシオグンホロノベチョウ","TESHIO GUN HORONOBE CHO","01","北海道","ホッカイドウ","HOKKAIDO","false"
"01543","網走郡美幌町","アバシリグンビホロチョウ","ABASHIRI GUN BIHORO CHO","01","北海道","ホッカイドウ","HOKKAIDO","false"
"01544","網走郡津別町","アバシリグンツベツチョウ","ABASHIRI GUN TSUBETSU CHO","01","北海道","ホッカイドウ","HOKKAIDO","false"
"01545","斜里郡斜里町","シャリグンシャリチョウ","SHARI GUN SHARI CHO","01","北海道","ホッカイドウ","HOKKAIDO","false"
"01546","斜里郡清里町","シャリグンキヨサトチョウ","SHARI GUN KIYOSATO CHO","01","北海道","ホッカイドウ","HOKKAIDO","false"
"01547","斜里郡小清水町","シャリグンコシミズチョウ","SHARI GUN KOSHIMIZU CHO","01","北海道","ホッカイドウ","HOKKAIDO","false"
"01549","常呂郡訓子府町","トコログンクンネップチョウ","TOKORO GUN KUNNEPPU CHO","01","北海道","ホッカイドウ","HOKKAIDO","false"
"01550","常呂郡置戸町","トコログンオケトチョウ","TOKORO GUN OKETO CHO","01","北海道","ホッカイドウ","HOKKAIDO","false"
"01552","常呂郡佐呂間町","トコログンサロマチョウ","TOKORO GUN SAROMA CHO","01","北海道","ホッカイドウ","HOKKAIDO","false"
"01555","紋別郡遠軽町","モンベツグンエンガルチョウ","MOMBETSU GUN ENGARU CHO","01","北海道","ホッカイドウ","HOKKAIDO","false"
"01559","紋別郡湧別町","モンベツグンユウベツチョウ","MOMBETSU GUN YUBETSU CHO","01","北海道","ホッカイドウ","HOKKAIDO","false"
"01560","紋別郡滝上町","モンベツグンタキノウエチョウ","MOMBETSU GUN TAKINOE CHO","01","北海道","ホッカイドウ","HOKKAIDO","false"
"01561","紋別郡興部町","モンベツグンオコッペチョウ","MOMBETSU GUN OKOPPE CHO","01","北海道","ホッカイドウ","HOKKAIDO","false"
"01562","紋別郡西興部村","モンベツグンニシオコッペムラ","MOMBETSU GUN NISHIOKOPPE MURA","01","北海道","ホッカイドウ","HOKKAIDO","false"
"01563","紋別郡雄武町","モンベツグンオウムチョウ","MOMBETSU GUN OMU CHO","01","北海道","ホッカイドウ","HOKKAIDO","false"
"01564","網走郡大空町","アバシリグンオオゾラチョウ","ABASHIRI GUN OZORA CHO","01","北海道","ホッカイドウ","HOKKAIDO","false"
"01571","虻田郡豊浦町","アブタグントヨウラチョウ","ABUTA GUN TOYORA CHO","01","北海道","ホッカイドウ","HOKKAIDO","false"
"01575","有珠郡壮瞥町","ウスグンソウベツチョウ","USU GUN SOBETSU CHO","01","北海道","ホッカイドウ","HOKKAIDO","false"
"01578","白老郡白老町","シラオイグンシラオイチョウ","SHIRAOI GUN SHIRAOI CHO","01","北海道","ホッカイドウ","HOKKAIDO","false"
"01581","勇払郡厚真町","ユウフツグンアツマチョウ","YUFUTSU GUN ATSUMA CHO","01","北海道","ホッカイドウ","HOKKAIDO","false"
"01584","虻田郡洞爺湖町","アブタグントウヤコチョウ","ABUTA GUN TOYAKO CHO","01","北海道","ホッカイドウ","HOKKAIDO","false"
"01585","勇払郡安平町","ユウフツグンアビラチョウ","YUFUTSU GUN ABIRA CHO","01","北海道","ホッカイドウ","HOKKAIDO","false"
"01586","勇払郡むかわ町","ユウフツグンムカワチョウ","YUFUTSU GUN MUKAWA CHO","01","北海道","ホッカイドウ","HOKKAIDO","false"
"01601","沙流郡日高町","サルグンヒダカチョウ","SARU GUN HIDAKA CHO","01","北海道","ホッカイドウ","HOKKAIDO","false"
"01602","沙流郡平取町","サルグンビラトリチョウ","SARU GUN BIRATORI CHO","01","北海道","ホッカイドウ","HOKKAIDO","false"
"01604","新冠郡新冠町","ニイカップグンニイカップチョウ","NIIKAPPU GUN NIIKAPPU CHO","01","北海道","ホッカイドウ","HOKKAIDO","false"
"01607","浦河郡浦河町","ウラカワグンウラカワチョウ","URAKAWA GUN URAKAWA CHO","01","北海道","ホッカイドウ","HOKKAIDO","false"
"01608","様似郡様似町","サマニグンサマニチョウ","SAMANI GUN SAMANI CHO","01","北海道","ホッカイドウ","HOKKAIDO","false"
"01609","幌泉郡えりも町","ホロイズミグンエリモチョウ","HOROIZUMI GUN ERIMO CHO","01","北海道","ホッカイドウ","HOKKAIDO","false"
"01610","日高郡新ひだか町","ヒダカグンシンヒダカチョウ","HIDAKA GUN SHINHIDAKA CHO","01","北海道","ホッカイドウ","HOKKAIDO","false"
"01631","河東郡音更町","カトウグンオトフケチョウ","KATO GUN OTOFUKE CHO","01","北海道","ホッカイドウ","HOKKAIDO","false"
"01632","河東郡士幌町","カトウグンシホロチョウ","KATO GUN SHIHORO CHO","01","北海道","ホッカイドウ","HOKKAIDO","false"
"01633","河東郡上士幌町","カトウグンカミシホロチョウ","KATO GUN KAMISHIHORO CHO","01","北海道","ホッカイドウ","HOKKAIDO","false"
"01634","河東郡鹿追町","カトウグンシカオイチョウ","KATO GUN SHIKAOI CHO","01","北海道","ホッカイドウ","HOKKAIDO","false"
"01635","上川郡新得町","カミカワグンシントクチョウ","KAMIKAWA GUN SHINTOKU CHO","01","北海道","ホッカイドウ","HOKKAIDO","false"
"01636","上川郡清水町","カミカワグンシミズチョウ","KAMIKAWA GUN SHIMIZU CHO","01","北海道","ホッカイドウ","HOKKAIDO","false"
"01637","河西郡芽室町","カサイグンメムロチョウ","KASAI GUN MEMURO CHO","01","北海道","ホッカイドウ","HOKKAIDO","false"
"01638","河西郡中札内村","カサイグンナカサツナイムラ","KASAI GUN NAKASATSUNAI MURA","01","北海道","ホッカイドウ","HOKKAIDO","false"
"01639","河西郡更別村","カサイグンサラベツムラ","KASAI GUN SARABETSU MURA","01","北海道","ホッカイドウ","HOKKAIDO","false"
"01641","広尾郡大樹町","ヒロオグンタイキチョウ","HIRO GUN TAIKI CHO","01","北海道","ホッカイドウ","HOKKAIDO","false"
"01642","広尾郡広尾町","ヒロオグンヒロオチョウ","HIRO GUN HIRO CHO","01","北海道","ホッカイドウ","HOKKAIDO","false"
"01643","中川郡幕別町","ナカガワグンマクベツチョウ","NAKAGAWA GUN MAKUBETSU CHO","01","北海道","ホッカイドウ","HOKKAIDO","false"
"01644","中川郡池田町","ナカガワグンイケダチョウ","NAKAGAWA GUN IKEDA CHO","01","北海道","ホッカイドウ","HOKKAIDO","false"
"01645","中川郡豊頃町","ナカガワグントヨコロチョウ","NAKAGAWA GUN TOYOKORO CHO","01","北海道","ホッカイドウ","HOKKAIDO","false"
"01646","中川郡本別町","ナカガワグンホンベツチョウ","NAKAGAWA GUN HOMBETSU CHO","01","北海道","ホッカイドウ","HOKKAIDO","false"
"01647","足寄郡足寄町","アショログンアショロチョウ","ASHORO GUN ASHORO CHO","01","北海道","ホッカイドウ","HOKKAIDO","false"
"01648","足寄郡陸別町","アショログンリクベツチョウ","ASHORO GUN RIKUBETSU CHO","01","北海道","ホッカイドウ","HOKKAIDO","false"
"01649","十勝郡浦幌町","トカチグンウラホロチョウ","TOKACHI GUN URAHORO CHO","01","北海道","ホッカイドウ","HOKKAIDO","false"
"01661","釧路郡釧路町","クシログンクシロチョウ","KUSHIRO GUN KUSHIRO CHO","01","北海道","ホッカイドウ","HOKKAIDO","false"
"01662","厚岸郡厚岸町","アッケシグンアッケシチョウ","AKKESHI GUN AKKESHI CHO","01","北海道","ホッカイドウ","HOKKAIDO","false"
"01663","厚岸郡浜中町","アッケシグンハマナカチョウ","AKKESHI GUN HAMANAKA CHO","01","北海道","ホッカイドウ","HOKKAIDO","false"
